{
    "$schema": "http://json-schema.org/draft-07/schema",
    "type": "object",
    "title": "Charcoal Theme",
    "description": "Provides a color scheme for Charcoal",
    "properties": {
        "Graph": {
            "type": "object",
            "properties": {
                "background": {
                    "type": "string"
                },
                "axis": {
                    "type": "string"
                },
                "font": {
                    "type": "string"
                },
                "equationColors": {
                    "type": "array",
                    "items": {
                        "type": "string"
                    },
                    "uniqueItems": true,
                    "minItems": 1
                }
            },
            "required": ["background", "axis", "font", "equationColors"]
        },
        "Calculator": {
            "type": "object",
            "properties": {
                "input": {
                    "type": "object",
                    "properties": {
                        "font": {
                            "type": "string",
                            "description": "Sets the font for the entire application"
                        },
                        "answerFont": {
                            "type": "string"
                        },
                        "answerBackground": {
                            "type": "string"
                        },
                        "background": {
                            "type": "string",
                            "description": "Sets the main background of the entire application"
                        }
                    },
                    "required": ["font", "answerFont", "answerBackground", "background"]
                },
                "background": {
                    "type": "string"
                },
                "font": {
                    "type": "string"
                }
            },
            "required": ["input", "background", "buttons"]
        },
        "TitleBar": {
            "type": "object",
            "properties": {
                "font": {
                    "type": "string"
                },
                "background": {
                    "type": "string"
                },
                "buttons": {
                    "type": "object",
                    "properties": {
                        "submenuhover": {
                            "type": "string"
                        }
                    },
                    "required": ["submenuhover"]
                }
            },
            "required": ["font", "background", "buttons"]
        },
        "defaultButtons": {
            "type": "object",
            "properties": {
                "active": {
                    "type": "string"
                },
                "hover": {
                    "type": "string"
                },
                "color": {
                    "type": "string"
                },
                "font": {
                    "type": "string"
                }
            },
            "required": ["active", "hover", "color", "font"]
        }
    },
    "required": ["Graph", "Calculator", "TitleBar", "defaultButtons"]
}
