{
    "Graph": {
        "background": "#FFF",
        "axis": "#333",
        "font": "#000",
        "equationColors": ["#ff8000", "#00f", "#0f0"]
    },
    "Calculator": {
        "input": {
            "font": "#000",
            "answerFont": "#FFF",
            "answerBackground": "#FFFFF",
            "background": "#FFF"
        },
        "background": "#f0f0f0",
        "font": "#333",
        "buttons": {
            "active": "#999",
            "hover": "#888"
        }
    },
    "TitleBar": {
        "font": "#FFF",
        "background": "#777",
        "buttons": {
            "submenuhover": "#444"
        }
    },
    "defaultButtons": {
        "active": "#333",
        "hover": "#555",
        "color": "#777",
        "font": "#FFF"
    }
}
