{
    "Graph": {
        "background": "#000",
        "axis": "#FD971F",
        "font": "#FFF",
        "equationColors": ["#02a2ff", "#ff0252", "#52ff02"]
    },
    "Calculator": {
        "input": {
            "font": "#000",
            "answerFont": "#FFF",
            "answerBackground": "#686868",
            "background": "#FFF"
        },
        "background": "#3F3F3F",
        "font": "#FFF",
        "buttons": {
            "active": "#994d00",
            "hover": "#cc6600"
        }
    },
    "TitleBar": {
        "font": "#FFF",
        "background": "#111",
        "buttons": {
            "submenuhover": "#232323"
        }
    },
    "defaultButtons": {
        "hover": "#2b2b2b",
        "active": "#191919",
        "font": "#FFF",
        "color": "#222222"
    }
}
